References,DOIS,Iteration,Status
"M. Staron, L. Kuzniarz, C. Wohlin, ""Empirical assessment of using stereotypes to improve comprehension of UML models: A set of experiments"", J. Syst. Softw., 2006.",https://doi.org/10.1016/j.jss.2005.09.014,1,Extraction successful
"T. Gorschek, C. Wohlin, ""Requirements Abstraction Model"", Requirements Engineering, 2005.",https://doi.org/10.1007/s00766-005-0020-7,1,Extraction successful
"A. Hevner, S. March, Jinsoo Park, S. Ram, ""Design Science in Information Systems Research"", MIS Q., 2004.",https://doi.org/10.2307/25148625,1,Extraction successful
"A. Kornecki, S. Khajenoori, D. Gluch, N. Kameli, ""On a partnership between software industry and academia"", Proceedings 16th Conference on Software Engineering Education and Training, 2003. (CSEE&T 2003)., 2003.",https://doi.org/10.1109/CSEE.2003.1191351,1,Extraction successful
"V. Basili, F. McGarry, R. Pajerski, M. Zelkowitz, ""Lessons learned from 25 years of process improvement: the rise and fall of the NASA software engineering laboratory"", Proceedings of the 24th International Conference on Software Engineering. ICSE 2002, 2002.",https://doi.org/10.1145/581339.581351,1,Extraction successful
"G. Pour, M. Griss, M. Lutz, ""The push to make software engineering respectable"", Computer, 2000.",https://doi.org/10.1109/2.841782,1,Extraction successful
"C. Wohlin, B. Regnell, ""Achieving industrial relevance in software engineering education"", Proceedings 12th Conference on Software Engineering Education and Training (Cat. No.PR00131), 1999.",https://doi.org/10.1109/CSEE.1999.755175,1,Extraction successful
"K. Beckman, N. Coulter, S. Khajenoori, N. Mead, ""Collaborations: Closing the Industry-Academia Gap"", IEEE Softw., 1997.",https://doi.org/10.1109/52.636668,1,Extraction successful
"L. Votta, A. Porter, ""Experimental Software Engineering: A Report on the State of the Art"", 1995 17th International Conference on Software Engineering, 1995.",https://doi.org/10.1145/225014.225040,1,Abstract not found
"C. Wohlin, Håkan Grahn, L. Philips, S. Kågström, E. Angelis, Per Rovegard, T. Gorschek, J. Winter, G. Low, Kennet Henningsson, A. Aurum, Piotr Tomaszewski, Y. Dittrich, C. V. Toorn, ""Success Factors Powering Industry-Academia Collaboration in Software Research"", , 2012.",https://doi.org/10.1109/ms.2011.92,1,Extraction successful
"Christopher B. Califf, Tanya Beaulieu, Todd Martin, ""Engaged Scholarship: A Guide for Organizational and Social Research"", , 2012.",https://doi.org/10.1080/15228053.2012.10845707,1,Abstract not found
"L. Pareto, Peter S. Eriksson, Staffan Ehnebom, ""Concern Visibility in Base Station Development - An Empirical Investigation"", MoDELS, 2009.",https://doi.org/10.1007/978-3-642-04425-0_15,1,Extraction successful
"M. Staron, Wilhelm Meding, Christer Nilsson, ""A framework for developing measurement systems and its industrial evaluation"", Inf. Softw. Technol., 2009.",https://doi.org/10.1016/j.infsof.2008.10.001,1,Extraction successful
"A. Sandberg, L. Pareto, U. Snis, M. Staron, ""Continuing professional development by practitioner integrated learning"", OOPSLA '07, 2007.",https://doi.org/10.1145/1297846.1297941,1,Extraction successful
"H. D. Rombach, R. Achatz, ""Research Collaborations between Academia and Industry"", Future of Software Engineering (FOSE '07), 2007.",https://doi.org/10.1109/FOSE.2007.16,1,Extraction successful
"T. Gorschek, P. Garre, S. Larsson, C. Wohlin, ""A Model for Technology Transfer in Practice"", IEEE Software, 2006.",https://doi.org/10.1109/MS.2006.147,1,Extraction successful
"T. Arts, John Hughes, J. Johansson, Ulf T. Wiger, ""Testing telecoms software with quviq QuickCheck"", ERLANG '06, 2006.",https://doi.org/10.1145/1159789.1159792,1,Extraction successful
"Eva-María Mora-Valentín, Ángeles Montoro-Sánchez, L. Guerras-Martín, ""Determining factors in the success of R&D cooperative agreements between firms and research organizations"", , 2004.",https://doi.org/10.1016/S0048-7333(03)00087-8,1,Extraction successful
"T. Barnes, I. Pashby, Anne Gibbons, ""Effective University - Industry Interaction: A Multi-case Evaluation of Collaborative R&D Projects"", , 2002.",https://doi.org/10.1016/S0263-2373(02)00044-0,1,Extraction successful
"M. Beer, ""Why Management Research Findings Are Unimplementable: An Action Science Perspective"", , 2001.",https://doi.org/10.1162/152417301570383,1,Abstract not found
"L. Mathiassen, ""Collaborative Practice Research"", Scand. J. Inf. Syst., 2002.",https://doi.org/10.1108/09593840210453115,1,Extraction successful
"L. Applegate, ""Rigor and Relevance in MIS Research-Introduction"", , 1999.",https://doi.org/10.2307/249402,1,Abstract not found
"D. Schoen, ""The reflective practitioner: how professionals think in action basic books inc"", , 1985.",https://doi.org/10.2307/3324262,1,Abstract not found
"Anne Börjesson, ""Making Software Process Improvement Happen"", , 2006.",No doi,1,DOI not found
"Donald A. Sch, ""The reflective practitioner: how professionals think in action"", , 1983.",No doi,1,DOI not found
