References,DOIS,Iteration,Status
"K. Petersen, Çigdem Gencel, Negin Asghari, Stefanie Betz, ""An elicitation instrument for operationalising GQM+Strategies (GQM+S-EI)"", Empirical Software Engineering, 2015.",https://doi.org/10.1007/s10664-014-9306-z,1,Abstract not found
"Hussan Munir, M. Moayyed, K. Petersen, ""Considering rigor and relevance when evaluating test driven development: A systematic review"", Inf. Softw. Technol., 2014.",https://doi.org/10.1016/j.infsof.2014.01.002,1,Abstract not found
"Çigdem Gencel, K. Petersen, A. Mughal, M. Iqbal, ""A decision support framework for metrics selection in goal-based measurement programs: GQM-DSFMS"", J. Syst. Softw., 2013.",https://doi.org/10.1016/j.jss.2013.07.022,1,Extraction successful
"K. Petersen, Çigdem Gencel, ""Worldviews, Research Methods, and their Relationship to Validity in Empirical Software Engineering Research"", 2013 Joint Conference of the 23rd International Workshop on Software Measurement and the 8th International Conference on Software Process and Product Measurement, 2013.",https://doi.org/10.1109/IWSM-Mensura.2013.22,1,Extraction successful
"D. Baca, K. Petersen, ""Countermeasure graphs for software security risk assessment: An action research"", J. Syst. Softw., 2013.",https://doi.org/10.1016/j.jss.2013.04.023,1,Extraction successful
"D. Baca, B. Carlsson, K. Petersen, L. Lundberg, ""Improving software security with static automated code analysis in an industry setting"", Softw. Pract. Exp., 2013.",https://doi.org/10.1002/spe.2109,1,Extraction successful
"Sara Mahdavi-Hezavehi, M. Galster, P. Avgeriou, ""Variability in quality attributes of service-based software systems: A systematic literature review"", Inf. Softw. Technol., 2013.",https://doi.org/10.1016/j.infsof.2012.08.010,1,Abstract not found
"Frank Elberzhager, Alla Rosbach, Jürgen Münch, R. Eschbach, ""Reducing test effort: A systematic mapping study on existing approaches"", Inf. Softw. Technol., 2012.",https://doi.org/10.1016/j.infsof.2012.04.007,1,Abstract not found
"Martin Ivarsson, T. Gorschek, ""A method for evaluating rigor and industrial relevance of technology evaluations"", Empirical Software Engineering, 2011.",https://doi.org/10.1007/s10664-010-9146-4,1,Extraction successful
"D. Baca, K. Petersen, ""Prioritizing Countermeasures through the Countermeasure Method for Software Security (CM-Sec)"", PROFES, 2010.",https://doi.org/10.1007/978-3-642-13792-1_15,1,Extraction successful
"P. Santos, G. Travassos, ""Action research use in software engineering: An initial survey"", 2009 3rd International Symposium on Empirical Software Engineering and Measurement, 2009.",https://doi.org/10.1145/1671248.1671296,1,BIB not found
"K. Petersen, C. Wohlin, ""Context in industrial software engineering research"", 2009 3rd International Symposium on Empirical Software Engineering and Measurement, 2009.",https://doi.org/10.1109/ESEM.2009.5316010,1,Extraction successful
"Martin Ivarsson, T. Gorschek, ""Technology transfer decision support in requirements engineering research: a systematic review of REj"", Requirements Engineering, 2009.",https://doi.org/10.1007/s00766-009-0080-1,1,Extraction successful
"M. Staron, Wilhelm Meding, Christer Nilsson, ""A framework for developing measurement systems and its industrial evaluation"", Inf. Softw. Technol., 2009.",https://doi.org/10.1016/j.infsof.2008.10.001,1,Extraction successful
"P. Runeson, Martin Höst, ""Guidelines for conducting and reporting case study research in software engineering"", Empirical Software Engineering, 2009.",https://doi.org/10.1007/s10664-008-9102-8,1,Extraction successful
"M. Staron, Wilhelm Meding, ""Predicting weekly defect inflow in large software projects based on project planning and test status"", Inf. Softw. Technol., 2008.",https://doi.org/10.1016/j.infsof.2007.10.001,1,Extraction successful
"N. Maiden, S. Robertson, ""Developing use cases and scenarios in the requirements process"", Proceedings. 27th International Conference on Software Engineering, 2005. ICSE 2005., 2005.",https://doi.org/10.1145/1062455.1062555,1,Abstract not found
"E. Fernández-Medina, M. Piattini, ""Designing secure databases"", Inf. Softw. Technol., 2005.",https://doi.org/10.1016/j.infsof.2004.09.013,1,Abstract not found
"Marjo Kauppinen, M. Vartiainen, J. Kontio, Sari Kujala, R. Sulonen, ""Implementing requirements engineering processes throughout organizations: success factors and challenges"", Inf. Softw. Technol., 2004.",https://doi.org/10.1016/j.infsof.2004.04.002,1,Extraction successful
"M. Polo, M. Piattini, F. Ruiz, ""Using a qualitative research method for building a software maintenance methodology"", Softw. Pract. Exp., 2002.",https://doi.org/10.1002/spe.481,1,Extraction successful
"R. Glass, I. Vessey, V. Ramesh, ""Research in software engineering: an analysis of the literature"", Inf. Softw. Technol., 2002.",https://doi.org/10.1016/S0950-5849(02)00049-6,1,Extraction successful
"J. McKay, P. Marshall, ""The dual imperatives of action research"", Inf. Technol. People, 2001.",https://doi.org/10.1108/09593840110384771,1,Extraction successful
"J. Meyer, ""Evaluating action research."", Age and ageing, 2000.",https://doi.org/10.1093/OXFORDJOURNALS.AGEING.A008104,1,Abstract not found
"K. Kautz, H. Hansen, Kim Thaysen, ""Applying and adjusting a software process improvement model in practice: the use of the IDEAL model in a small software enterprise"", Proceedings of the 2000 International Conference on Software Engineering. ICSE 2000 the New Millennium, 2000.",https://doi.org/10.1145/337180.337492,1,Extraction successful
"D. Coghlan, ""Organization Development: Behavioral Science Interventions for Organization Improvement (6th ed.)"", , 2000.",https://doi.org/10.1108/LODJ.2000.21.1.62.3,1,Abstract not found
"C. Wohlin, P. Runeson, Martin Höst, M. C. Ohlsson, B. Regnell, ""Experimentation in Software Engineering"", The Kluwer International Series in Software Engineering, 2000.",https://doi.org/10.1007/978-1-4615-4625-2,1,Abstract not found
"R. Baskerville, ""Investigating Information Systems with Action Research"", Commun. Assoc. Inf. Syst., 1999.",https://doi.org/10.17705/1cais.00219,1,Extraction successful
"R. Westfall, ""An IS Research Relevancy Manifesto"", Commun. Assoc. Inf. Syst., 1999.",https://doi.org/10.17705/1cais.00214,1,Extraction successful
"P. Bengtsson, J. Bosch, ""Haemo dialysis software architecture design experiences"", Proceedings of the 1999 International Conference on Software Engineering (IEEE Cat. No.99CB37002), 1999.",https://doi.org/10.1145/302405.302684,1,Abstract not found
"Bob McFeeley, ""IDEAL: A User's Guide for Software Process Improvement."", , 1996.",https://doi.org/10.21236/ada305472,1,Abstract not found
"G. Susman, R. Evered, ""An Assessment of the Scientific Merits of Action Research."", , 1978.",https://doi.org/10.2307/2392581,1,Extraction successful
"P. Tichý, ""ON POPPER'S DEFINITIONS OF VERISIMILITUDE1"", The British Journal for the Philosophy of Science, 1974.",https://doi.org/10.1093/bjps/25.2.155,1,Extraction successful
"W. French, ""Organization Development: Behavioral Science Interventions for Organization Improvement"", , 1972.",https://doi.org/10.2307/2521470,1,Abstract not found
"M. Esfeld, Dustin Lazarovici, Vincent Lam, Mario Hubert, ""The British Journal for the Philosophy of Science"", Nature, 1957.",https://doi.org/10.1086/287572,1,Abstract not found
"F. Blum, ""Action Research--A Scientific Approach?"", Philosophy of Science, 1955.",https://doi.org/10.1086/287381,1,Extraction successful
"Olav Eikeland, ""The validity of action research - validity in action research"", , 2006.",No doi,1,DOI not found
"P. Checkland, ""From framework through experience to learning: The essential nature of action research"", , 1991.",No doi,1,DOI not found
"H. Nissen, H. Klein, R. Hirschheim, ""Information systems research: contemporary approaches and emergent traditions"", , 1991.",No doi,1,DOI not found
"Pilar Rodríguez, J. Partanen, P. Kuvaja, M. Oivo, ""Combining Lean Thinking and Agile Methods for Software Development: A Case Study of a Finnish Provider of Wireless Embedded Systems Detailed"", 2014 47th Hawaii International Conference on System Sciences, 2014.",https://doi.org/10.1109/HICSS.2014.586,1,Extraction successful
"C. Wohlin, ""Empirical software engineering research with industry: Top 10 challenges"", 2013 1st International Workshop on Conducting Empirical Studies in Industry (CESI), 2013.",https://doi.org/10.1109/CESI.2013.6618469,1,Extraction successful
"Sofia Sherman, I. Hadar, ""Conducting a long-term case study in a software firm: An experience report"", 2013 1st International Workshop on Conducting Empirical Studies in Industry (CESI), 2013.",https://doi.org/10.1109/CESI.2013.6618470,1,Extraction successful
"Shilpi Jain, M. Babar, J. Fernandez, ""Conducting empirical studies in industry: Balancing rigor and relevance"", 2013 1st International Workshop on Conducting Empirical Studies in Industry (CESI), 2013.",https://doi.org/10.1109/CESI.2013.6618463,1,Extraction successful
"Pilar Rodríguez, K. Mikkonen, P. Kuvaja, M. Oivo, J. Garbajosa, ""Building lean thinking in a telecom software development organization: strengths and challenges"", ICSSP 2013, 2013.",https://doi.org/10.1145/2486046.2486064,1,Abstract not found
"Teemu Karvonen, Pilar Rodríguez, P. Kuvaja, K. Mikkonen, M. Oivo, ""Adapting the Lean Enterprise Self-Assessment Tool for the Software Development Domain"", 2012 38th Euromicro Conference on Software Engineering and Advanced Applications, 2012.",https://doi.org/10.1109/SEAA.2012.51,1,Extraction successful
"C. Wohlin, A. Aurum, L. Angelis, Laura Phillips, Y. Dittrich, T. Gorschek, Håkan Grahn, Kennet Henningsson, S. Kågström, G. Low, Per Rovegard, Piotr Tomaszewski, C. V. Toorn, J. Winter, ""The Success Factors Powering Industry-Academia Collaboration"", IEEE Software, 2012.",https://doi.org/10.1109/MS.2011.92,1,Extraction successful
"M. C. Tremblay, A. Hevner, D. Berndt, ""Focus Groups for Artifact Refinement and Evaluation in Design Research"", Commun. Assoc. Inf. Syst., 2010.",https://doi.org/10.17705/1CAIS.02627,1,Extraction successful
"W. Kuechler, V. Vaishnavi, ""On theory development in design science research: anatomy of a research project"", Eur. J. Inf. Syst., 2008.",https://doi.org/10.1057/ejis.2008.40,1,Extraction successful
"K. Peffers, T. Tuunanen, M. Rothenberger, S. Chatterjee, ""A Design Science Research Methodology for Information Systems Research"", J. Manag. Inf. Syst., 2007.",https://doi.org/10.2753/MIS0742-1222240302,1,Extraction successful
"Davide Jones, S. Gregor, ""The Anatomy of a Design Theory"", J. Assoc. Inf. Syst., 2007.",https://doi.org/10.17705/1JAIS.00129,1,Extraction successful
"M. Bichler, ""Design science in information systems research"", Wirtschaftsinf., 2006.",https://doi.org/10.1007/s11576-006-0028-8,1,Abstract not found
"S. March, Gerald F. Smith, ""Design and natural science research on information technology"", Decis. Support Syst., 1995.",https://doi.org/10.1016/0167-9236(94)00041-2,1,Extraction successful
"Pilar Rodríguez, ""Combining lean thinking and agile software development : how do software-intensive companies use them in practice?"", , 2013.",No doi,1,DOI not found
"Silverio Martínez-Fernández, Claudia P. Ayala, X. Franch, Helena Martins Marques, ""Artifacts of software reference architectures: a case study"", EASE '14, 2014.",https://doi.org/10.1145/2601248.2601282,1,Extraction successful
"Silverio Martínez-Fernández, Claudia P. Ayala, X. Franch, Helena Martins Marques, ""Benefits and Drawbacks of Reference Architectures"", ECSA, 2013.",https://doi.org/10.1007/978-3-642-39031-9_26,1,Extraction successful
"Silverio Martínez-Fernández, Claudia P. Ayala, X. Franch, Helena Martins Marques, ""REARM: A Reuse-Based Economic Model for Software Reference Architectures"", ICSR, 2013.",https://doi.org/10.1007/978-3-642-38977-1_7,1,Extraction successful
"C. Wohlin, ""Empirical software engineering research with industry: Top 10 challenges"", 2013 1st International Workshop on Conducting Empirical Studies in Industry (CESI), 2013.",https://doi.org/10.1109/CESI.2013.6618469,1,Extraction successful
"M. Baldassarre, D. Caivano, G. Visaggio, ""Empirical studies for innovation dissemination: ten years of experience"", EASE '13, 2013.",https://doi.org/10.1145/2460999.2461020,1,Abstract not found
"P. Runeson, ""It Takes Two to Tango -- An Experience Report on Industry -- Academia Collaboration"", 2012 IEEE Fifth International Conference on Software Testing, Verification and Validation, 2012.",https://doi.org/10.1109/ICST.2012.190,1,Extraction successful
"C. Wohlin, A. Aurum, L. Angelis, Laura Phillips, Y. Dittrich, T. Gorschek, Håkan Grahn, Kennet Henningsson, S. Kågström, G. Low, Per Rovegard, Piotr Tomaszewski, C. V. Toorn, J. Winter, ""The Success Factors Powering Industry-Academia Collaboration"", IEEE Software, 2012.",https://doi.org/10.1109/MS.2011.92,1,Extraction successful
"M. Babar, P. Lago, A. Deursen, ""Empirical research in software architecture: opportunities, challenges, and approaches"", Empirical Software Engineering, 2011.",https://doi.org/10.1007/s10664-011-9168-6,1,Extraction successful
"A. Sandberg, L. Pareto, T. Arts, ""Agile Collaborative Research: Action Principles for Industry-Academia Collaboration"", IEEE Software, 2011.",https://doi.org/10.1109/MS.2011.49,1,Extraction successful
"A. MacCormack, J. Rusnak, C. Baldwin, ""Exploring the Duality between Product and Organizational Architectures: A Test of the Mirroring Hypothesis"", , 2011.",https://doi.org/10.2139/ssrn.1104745,1,Abstract not found
"M. Babar, L. Bass, I. Gorton, ""Factors Influencing Industrial Practices of Software Architecture Evaluation: An Empirical Investigation"", QoSA, 2007.",https://doi.org/10.1007/978-3-540-77619-2_6,1,Extraction successful
"T. Gorschek, P. Garre, S. Larsson, C. Wohlin, ""A Model for Technology Transfer in Practice"", IEEE Software, 2006.",https://doi.org/10.1109/MS.2006.147,1,Extraction successful
"S. Pfleeger, ""Understanding and improving technology transfer in software engineering"", J. Syst. Softw., 1999.",https://doi.org/10.1016/S0164-1212(99)00031-X,1,Extraction successful
"Silverio Martínez-Fernández, Claudia P. Ayala, X. Franch, Helena Martins Marques, David Ameller, ""A Framework for Software Reference Architecture Analysis and Review"", CIbSE, 2013.",No doi,1,DOI not found
"J. Poulin, ""Measuring software reuse - principles, practices, and economic models"", , 1996.",No doi,1,DOI not found
"P. Runeson, Sten Minör, ""The 4+1 view model of industry--academia collaboration"", WISE@ASE, 2014.",https://doi.org/10.1145/2647648.2647651,1,Done already in 1.0
"Alma Orucevic-Alagic, Martin Höst, ""Network Analysis of a Large Scale Open Source Project"", 2014 40th EUROMICRO Conference on Software Engineering and Advanced Applications, 2014.",https://doi.org/10.1109/SEAA.2014.50,1,Extraction successful
"Jan Kasper Martinsen, Håkan Grahn, Anders Isberg, ""Heuristics for Thread-Level Speculation in Web Applications"", IEEE Computer Architecture Letters, 2014.",https://doi.org/10.1109/L-CA.2013.26,1,Extraction successful
"E. Bjarnason, K. Smolander, Emelie Engström, P. Runeson, ""Alignment practices affect distances in software development: a theory and a model"", GTSE 2014, 2014.",https://doi.org/10.1145/2593752.2593757,1,Extraction successful
"E. Bjarnason, P. Runeson, Markus Borg, M. Unterkalmsteiner, Emelie Engström, B. Regnell, Giedre Sabaliauskaite, A. Loconsole, T. Gorschek, R. Feldt, ""Challenges and practices in aligning requirements with verification and validation: a case study of six companies"", Empirical Software Engineering, 2014.",https://doi.org/10.1007/s10664-013-9263-y,1,Abstract not found
"B. Magnusson, Björn A. Johnsson, ""Some like it hot: automating an electric kettle using PalCom"", UbiComp, 2013.",https://doi.org/10.1145/2494091.2494110,1,Extraction successful
"C. Wohlin, ""Empirical software engineering research with industry: Top 10 challenges"", 2013 1st International Workshop on Conducting Empirical Studies in Industry (CESI), 2013.",https://doi.org/10.1109/CESI.2013.6618469,1,Extraction successful
"P. Runeson, ""It Takes Two to Tango -- An Experience Report on Industry -- Academia Collaboration"", 2012 IEEE Fifth International Conference on Software Testing, Verification and Validation, 2012.",https://doi.org/10.1109/ICST.2012.190,1,Extraction successful
"P. Runeson, Martin Höst, A. Rainer, B. Regnell, ""Case Study Research in Software Engineering - Guidelines and Examples"", , 2012.",https://doi.org/10.1002/9781118181034,1,Extraction successful
"C. Wohlin, A. Aurum, L. Angelis, Laura Phillips, Y. Dittrich, T. Gorschek, Håkan Grahn, Kennet Henningsson, S. Kågström, G. Low, Per Rovegard, Piotr Tomaszewski, C. V. Toorn, J. Winter, ""The Success Factors Powering Industry-Academia Collaboration"", IEEE Software, 2012.",https://doi.org/10.1109/MS.2011.92,1,Extraction successful
"A. Sandberg, L. Pareto, T. Arts, ""Agile Collaborative Research: Action Principles for Industry-Academia Collaboration"", IEEE Software, 2011.",https://doi.org/10.1109/MS.2011.49,1,Extraction successful
"T. Gorschek, P. Garre, S. Larsson, C. Wohlin, ""A Model for Technology Transfer in Practice"", IEEE Software, 2006.",https://doi.org/10.1109/MS.2006.147,1,Extraction successful
"P. Runeson, Sten Minör, Johan Svenér, ""Get the cogs in synch: time horizon aspects of industry--academia collaboration"", WISE@ASE, 2014.",https://doi.org/10.1145/2647648.2647652,1,Done already in 1.0
"Emelie Engström, M. Mäntylä, P. Runeson, Markus Borg, ""Supporting Regression Test Scoping with Visual Analytics"", 2014 IEEE Seventh International Conference on Software Testing, Verification and Validation, 2014.",https://doi.org/10.1109/ICST.2014.41,1,Extraction successful
"Jesper Pedersen Notander, Martin Höst, P. Runeson, ""Challenges in Flexible Safety-Critical Software Development - An Industrial Qualitative Survey"", PROFES, 2013.",https://doi.org/10.1007/978-3-642-39259-7_23,1,Extraction successful
"C. Wohlin, ""Empirical software engineering research with industry: Top 10 challenges"", 2013 1st International Workshop on Conducting Empirical Studies in Industry (CESI), 2013.",https://doi.org/10.1109/CESI.2013.6618469,1,Extraction successful
"P. Runeson, ""It Takes Two to Tango -- An Experience Report on Industry -- Academia Collaboration"", 2012 IEEE Fifth International Conference on Software Testing, Verification and Validation, 2012.",https://doi.org/10.1109/ICST.2012.190,1,Extraction successful
"A. Sandberg, L. Pareto, T. Arts, ""Agile Collaborative Research: Action Principles for Industry-Academia Collaboration"", IEEE Software, 2011.",https://doi.org/10.1109/MS.2011.49,1,Extraction successful
"Emelie Engström, P. Runeson, M. Skoglund, ""A systematic review on regression test selection techniques"", Inf. Softw. Technol., 2010.",https://doi.org/10.1016/j.infsof.2009.07.001,1,Extraction successful
"T. Gorschek, P. Garre, S. Larsson, C. Wohlin, ""A Model for Technology Transfer in Practice"", IEEE Software, 2006.",https://doi.org/10.1109/MS.2006.147,1,Extraction successful
"W. Duncan, ""A GUIDE TO THE PROJECT MANAGEMENT BODY OF KNOWLEDGE"", , 1996.",https://doi.org/10.5860/choice.34-1636,1,Abstract not found
"Philippe B Kruchten, ""The 4+1 View Model of Architecture"", IEEE Softw., 1995.",https://doi.org/10.1109/52.469759,1,Extraction successful
"Eduard Paul Enoiu, Daniel Sundmark, P. Pettersson, ""Using Logic Coverage to Improve Testing Function Block Diagrams"", ICTSS, 2013.",https://doi.org/10.1007/978-3-642-41707-8_1,1,Extraction successful
"Sigrid Eldh, ""Some researcher considerations when conducting empirical studies in industry"", 2013 1st International Workshop on Conducting Empirical Studies in Industry (CESI), 2013.",https://doi.org/10.1109/CESI.2013.6618476,1,Extraction successful
"Eduard Paul Enoiu, Kivanc Doganay, M. Bohlin, Daniel Sundmark, P. Pettersson, ""MOS: An integrated model-based and search-based testing tool for Function Block Diagrams"", 2013 1st International Workshop on Combining Modelling and Search-Based Software Engineering (CMSBSE), 2013.",https://doi.org/10.1109/CMSBSE.2013.6605711,1,Extraction successful
"Eduard Paul Enoiu, Daniel Sundmark, P. Pettersson, ""Model-Based Test Suite Generation for Function Block Diagrams Using the UPPAAL Model Checker"", 2013 IEEE Sixth International Conference on Software Testing, Verification and Validation Workshops, 2013.",https://doi.org/10.1109/ICSTW.2013.27,1,Extraction successful
"D. Czarnitzki, Christoph Grimpe, Andrew A. Toole, ""Delay and Secrecy: Does Industry Sponsorship Jeopardize Disclosure of Academic Research?"", , 2011.",https://doi.org/10.2139/ssrn.1786378,1,Abstract not found
"Shaukat Ali, L. Briand, H. Hemmati, R. Panesar-Walawege, ""A Systematic Review of the Application and Empirical Investigation of Search-Based Test Case Generation"", IEEE Transactions on Software Engineering, 2010.",https://doi.org/10.1109/TSE.2009.52,1,Extraction successful
"W. E. Wong, T. H. Tse, R. Glass, V. Basili, T. Chen, ""An assessment of systems and software engineering scholars and institutions (2001-2005)"", J. Syst. Softw., 2008.",https://doi.org/10.1016/j.jss.2007.09.018,1,Extraction successful
"M. Perkmann, K. Walsh, ""Engaging the Scholar: Three Types of Academic Consulting and Their Impact on Universities and Industry"", , 2008.",https://doi.org/10.1016/J.RESPOL.2008.07.009,1,Extraction successful
"M. Perkmann, K. Walsh, ""University Industry Relationships and Open Innovation: Towards a Research Agenda"", , 2007.",https://doi.org/10.1111/j.1468-2370.2007.00225.x,1,Extraction successful
"L. Dooley, D. Kirk, ""University‐industry collaboration"", , 2007.",https://doi.org/10.1108/14601060710776734,1,Abstract not found
"Y. Lee, ""The Sustainability of University-Industry Research Collaboration: An Empirical Assessment"", , 2000.",https://doi.org/10.1023/A:1007895322042,1,Extraction successful
"Y. Lee, ""'TECHNOLOGY TRANSFER' AND THE RESEARCH UNIVERSITY : A SEARCH FOR THE BOUNDARIES OF UNIVERSITY-INDUSTRY COLLABORATION"", , 1996.",https://doi.org/10.1016/0048-7333(95)00857-8,1,Extraction successful
"P. Grünbacher, Rick Rabiser, ""Success factors for empirical studies in industry-academia collaboration: A reflection"", 2013 1st International Workshop on Conducting Empirical Studies in Industry (CESI), 2013.",https://doi.org/10.1109/CESI.2013.6618466,1,Extraction successful
"C. Wohlin, A. Aurum, L. Angelis, Laura Phillips, Y. Dittrich, T. Gorschek, Håkan Grahn, Kennet Henningsson, S. Kågström, G. Low, Per Rovegard, Piotr Tomaszewski, C. V. Toorn, J. Winter, ""The Success Factors Powering Industry-Academia Collaboration"", IEEE Software, 2012.",https://doi.org/10.1109/MS.2011.92,1,Extraction successful
"P. Runeson, Martin Höst, ""Guidelines for conducting and reporting case study research in software engineering"", Empirical Software Engineering, 2009.",https://doi.org/10.1007/s10664-008-9102-8,1,Extraction successful
"M. Shaw, ""What makes good research in software engineering?"", International Journal on Software Tools for Technology Transfer, 2002.",https://doi.org/10.1007/s10009-002-0083-4,1,Extraction successful
"T. Barnes, I. Pashby, Anne Gibbons, ""Effective University - Industry Interaction: A Multi-case Evaluation of Collaborative R&D Projects"", , 2002.",https://doi.org/10.1016/S0263-2373(02)00044-0,1,Extraction successful
"Jess Gaspar, E. Glaeser, ""Information Technology and the Future of Cities"", , 1996.",https://doi.org/10.1006/JUEC.1996.2031,1,Extraction successful
"V. Basili, ""The role of experimentation in software engineering: past, current, and future"", Proceedings of IEEE 18th International Conference on Software Engineering, 1996.",https://doi.org/10.1109/ICSE.1996.493439,1,Extraction successful
"C. Darwin, ""The origin of species by means of natural selecti : or, The preservation of favored races in the struggle for life /"", , 1904.",https://doi.org/10.5962/BHL.TITLE.51879,1,Abstract not found
"C. Darwin, ""The Origin of Species by Means of Natural Selection, Or, The Preservation of Favoured Races in the Struggle for Life"", , 2019.",https://doi.org/10.1037/14088-000,1,Abstract not found
"J. Calof, Gregory Richards, L. Mirabeau, H. Mouftah, P. Mackinnon, P. Chapman, ""An Overview of the Demise of Nortel Networks and Key Lessons Learned : Systemic effects in environment , resilience and black-cloud formation"", , 2014.",No doi,1,DOI not found
"Jim Shore, S. Warden, ""The art of agile development"", , 2007.",No doi,1,DOI not found
"J. Maeda, ""The laws of simplicity"", Design, technology, business, life, 2006.",No doi,1,DOI not found
"C. Dede, ""The Evolution of Information Technology: Implications for Curriculum"", , 1989.",No doi,1,DOI not found
"P. Runeson, ""It Takes Two to Tango -- An Experience Report on Industry -- Academia Collaboration"", 2012 IEEE Fifth International Conference on Software Testing, Verification and Validation, 2012.",https://doi.org/10.1109/ICST.2012.190,1,Extraction successful
"C. Wohlin, A. Aurum, L. Angelis, Laura Phillips, Y. Dittrich, T. Gorschek, Håkan Grahn, Kennet Henningsson, S. Kågström, G. Low, Per Rovegard, Piotr Tomaszewski, C. V. Toorn, J. Winter, ""The Success Factors Powering Industry-Academia Collaboration"", IEEE Software, 2012.",https://doi.org/10.1109/MS.2011.92,1,Extraction successful
"T. Gorschek, P. Garre, S. Larsson, C. Wohlin, ""Industry evaluation of the Requirements Abstraction Model"", Requirements Engineering, 2007.",https://doi.org/10.1007/s00766-007-0047-z,1,Extraction successful
"T. Gorschek, P. Garre, S. Larsson, C. Wohlin, ""A Model for Technology Transfer in Practice"", IEEE Software, 2006.",https://doi.org/10.1109/MS.2006.147,1,Extraction successful
