References,DOIS,Iteration,Status
"L. Mathiassen, A. Sandberg, ""Complementary Technology Traces in Software Practice: A Retrospective Reflection over Sixteen Years of Evolution at Ericsson"", Eur. J. Inf. Syst., 2020.",https://doi.org/10.1080/0960085X.2020.1832867,1.0,Extraction successful
"Ernani José Fortunato Lisbôa Enke, M. Martens, Cristina Dai Prá Martens, Dariane Beatriz Shoffen Enke, J. C. Contador, Thyago Bachim, A. R. Coutinho, Walter Cardoso Satyro, ""Critical success factors in university-industry collaboration: a bibliometric analysis"", Research, Society and Development, 2021.",https://doi.org/10.33448/rsd-v10i13.21316,1.0,Extraction successful
"Silvia Ronsom, D. Amaral, José Eustáquio Ribeiro Vieira Filho, ""Identifying critical factors for agility in innovation ecosystems: an exploratory study in the agriculture sector"", Product Management & Development, 2021.",https://doi.org/10.4322/pmd.2021.009,1.0,Extraction successful
"Bianca Rodrigues Teixeira, B. Ferreira, A. L. B. Damasceno, Simone Diniz Junqueira Barbosa, Cassia Novello, Hugo Villamizar, M. Kalinowski, Thuener Silva, Jacques Chueke, H. Lopes, André Kuramoto, Bruno Itagyba, Cristiane Salgado, Sidney Comandulli, Marinho Fischer, L. Fialho, ""Lessons Learned from a Lean R&D Project"", ICEIS, 2021.",https://doi.org/10.5220/0010459803450352,1.0,Abstract not found
"D. Nitecki, Adi Alter, ""Leading FAIR Adoption Across the Institution: A Collaboration Between an Academic Library and a Technology Provider"", Data Sci. J., 2021.",https://doi.org/10.5334/dsj-2021-006,1.0,Abstract not found
"A. F. Barbosa, G. Neto, Maria Lencastre, Roberta Fagundes, W. Santos, ""Fostering Industry-Academia Collaboration in Software Engineering using Action Research: A Case Study"", SBQS, 2020.",https://doi.org/10.1145/3439961.3440005,1.0,Abstract not found
"H. Jaakkola, T. Mikkonen, Kari Systä, ""Anti-Patterns for an Industrial PhD in the Field of ICT"", 2020 IEEE Frontiers in Education Conference (FIE), 2020.",https://doi.org/10.1109/FIE44824.2020.9273826,1.0,Abstract not found
"D. Marijan, A. Gotlieb, ""Lessons Learned on Research Co-Creation: Making Industry-Academia Collaboration Work"", 2020 46th Euromicro Conference on Software Engineering and Advanced Applications (SEAA), 2020.",https://doi.org/10.1109/SEAA51224.2020.00053,1.0,Abstract not found
"C. Ingram, J. Chubb, Claire Boardman, M. Ursu, ""Generating Real-World Impact from Academic Research: Experience Report from a University Impact Hub"", ICSE, 2020.",https://doi.org/10.1145/3387940.3391479,1.0,Abstract not found
"Richa Awasthy, S. Flint, Ramesh Sankarnarayana, Richard L. Jones, ""A framework to improve university–industry collaboration"", , 2020.",https://doi.org/10.1108/jiuc-09-2019-0016,1.0,Abstract not found
"V. Garousi, M. Felderer, M. Kuhrmann, Kadir Herkiloglu, Sigrid Eldh, ""Exploring the industry's challenges in software testing: An empirical study"", J. Softw. Evol. Process., 2020.",https://doi.org/10.1002/smr.2251,1.0,Extraction successful
"Fernando Pastor Ricós, Pekka Aho, T. Vos, Ismael Torres Boigues, Ernesto Calás Blasco, Héctor Martínez Martínez, ""Deploying TESTAR to Enable Remote Testing in an Industrial CI Pipeline: A Case-Based Evaluation"", ISoLA, 2020.",https://doi.org/10.1007/978-3-030-61362-4_31,1.0,Extraction successful
"M. Staron, ""Action Research in Software Engineering: Theory and Applications"", , 2019.",https://doi.org/10.1007/978-3-030-32610-4,1.0,Extraction successful
"A. Gonera, R. Pabst, ""The Use of Design Thinking in Transdisciplinary Research and Innovation Consortia: Challenges, Enablers, and Benefits"", Journal of Innovation Management, 2019.",https://doi.org/10.24840/2183-0606_007.003_0006,1.0,Extraction successful
"A. Sannö, A. Öberg, Erik Flores-García, M. Jackson, ""Increasing the Impact of Industry–Academia Collaboration through Co-Production"", Technology Innovation Management Review, 2019.",https://doi.org/10.22215/TIMREVIEW/1232,1.0,Extraction successful
"V. Garousi, Dietmar Pfahl, João M. Fernandes, M. Felderer, M. Mäntylä, D. Shepherd, A. Arcuri, Ahmet Coşkunçay, B. Tekinerdogan, ""Characterizing industry-academia collaborations in software engineering: evidence from 101 projects"", Empirical Software Engineering, 2019.",https://doi.org/10.1007/s10664-019-09711-y,1.0,Abstract not found
"Erik Flores-García, ""Supporting Decision-Making in the Design of Production Systems : A Discrete Event Simulation perspective"", , 2019.",https://doi.org/10.1007/978-3-030-32610-4_2,1.0,Extraction successful
"M. Staron, ""Action Research as Research Methodology in Software Engineering"", , 2019.",https://doi.org/10.1007/978-3-030-32610-4_9,1.0,Extraction successful
"M. Staron, ""Ensuring Sustainability of Knowledge"", , 2019.",https://doi.org/10.1145/3239235.3239241,1.0,Extraction successful
"Mansooreh Zahedi, M. Babar, Brenton Cooper, ""An empirical investigation of transferring research to software technology innovation: a case of data-driven national security software"", ESEM, 2018.",https://doi.org/10.1177/8756972818781630,1.0,Extraction successful
"Marissa Takahashi, M. Indulska, J. Steen, ""Collaborative Research Project Networks"", Project Management Journal, 2018.",https://doi.org/10.1145/3193965.3193970,1.0,Extraction successful
"Katarzyna Biesialska, X. Franch, V. Muntés-Mulero, ""Protocol and Tools for Conducting Agile Software Engineering Research in an Industrial-Academic Setting: A Preliminary Study"", 2018 IEEE/ACM 6th International Workshop on Conducting Empirical Studies in Industry (CESI), 2018.",https://doi.org/10.1007/s13198-015-0352-8,1.0,Extraction successful
"S. Sen, D. Marijan, A. Gotlieb, ""Certus: an organizational effort towards research-based innovation in software verification and validation"", Int. J. Syst. Assur. Eng. Manag., 2018.",https://doi.org/10.23762/FSO_VOL6_NO4_6,1.0,Abstract not found
"Vard Antinyan, ""Proactive Software Complexity Assessment"", , 2018.",https://doi.org/10.15611/pn.2018.536.04,1.0,Abstract not found
"Agnieszka Domańska, ""Cooperation Between Knowledge-based Institutions and Business : Empirical Studies and Network Theories"", , 2018.",https://doi.org/10.1007/978-3-319-63874-4_15,1.0,Abstract not found
"Andrew Ross, ""Degree apprenticeships: Disruption or business as usual"", , 2018.",https://doi.org/10.1109/ICSE-SEIP.2017.20,1.0,Abstract not found
"Agnieszka Domańska, ""Start-up ecosystems as a framework for the cooperation between start-up companies and knowledge-based institutions in Poland"", , 2018.",https://doi.org/10.17632/Y5R8RZF3XG.243,1.0,Abstract not found
"Isabelle Guillot, Geetha Paulmani, Vivekanandan S. Kumar, S. Fraser, ""Case Studies of Industry-Academia Research Collaborations for Software Development with Agile"", CRIWG, 2017.",https://doi.org/10.1007/s11219-016-9319-5,1.0,Abstract not found
"A. Sandberg, I. Crnkovic, ""Meeting Industry-Academia Research Collaboration Challenges with Agile Methodologies"", 2017 IEEE/ACM 39th International Conference on Software Engineering: Software Engineering in Practice Track (ICSE-SEIP), 2017.",https://doi.org/10.1007/s11219-016-9322-x,1.0,Extraction successful
"Silverio Martínez-Fernández, Claudia P. Ayala, X. Franch, Helena Martins Marques, ""Benefits and drawbacks of software reference architectures: A case study"", Inf. Softw. Technol., 2017.",https://doi.org/10.1016/J.INFSOF.2016.07.006,1.0,Extraction successful
"V. Garousi, M. M. Eskandar, Kadir Herkiloglu, ""Industry–academia collaborations in software testing: experience and success stories from Canada and Turkey"", Software Quality Journal, 2017.",https://doi.org/10.18260/p.26455,1.0,Abstract not found
"Emelie Engström, K. Petersen, N. Ali, E. Bjarnason, ""SERP-test: a taxonomy for supporting industry–academia communication"", Software Quality Journal, 2017.",https://doi.org/10.1145/2896839.2896845,1.0,Extraction successful
"V. Garousi, K. Petersen, B. Özkan, ""Challenges and best practices in industry-academia collaborations in software engineering: A systematic literature review"", Inf. Softw. Technol., 2016.",https://doi.org/10.1016/j.jss.2015.10.051,1.0,Extraction successful
"Diane L. Peters, A. Lucietto, ""A Survey of Types of Industry-Academia Collaboration"", , 2016.",https://doi.org/10.1145/2856636.2856644,1.0,Extraction successful
"Silverio Martínez-Fernández, ""Gathering empirical evidence and building a business case for software reference architectures in industry"", , 2016.",https://doi.org/10.1007/978-3-319-31545-4_12,1.0,Extraction successful
"M. R. Karim, S. Alam, S. Kabeer, G. Ruhe, Basil Baluta, Shafquat Mahmud, ""Applying Data Analytics towards Optimized Issue Management: An Industrial Case Study"", 2016 IEEE/ACM 4th International Workshop on Conducting Empirical Studies in Industry (CESI), 2016.",https://doi.org/10.1007/978-3-319-26844-6_3,1.0,Extraction successful
"M. Staron, Wilhelm Meding, ""MeSRAM - A method for assessing robustness of measurement programs in large software development organizations and its industrial evaluation"", J. Syst. Softw., 2016.",https://doi.org/10.1145/2647648.2647652,1.0,Done already in 1.0
"B. Barn, T. Clark, Almaas A. Ali, Rabia Arif, ""A Systematic Mapping Study of the Current Practice of Indian Software Engineering"", ISEC, 2016.",https://doi.org/10.1145/2647648.2647651,1.0,Done already in 1.0
"K. Petersen, ""A Researcher’s Experiences in Supporting Industrial Software Process Improvement"", , 2016.",https://doi.org/10.1109/MS.2013.139,1.0,Extraction successful
"A. McLeod, ""Returns on investment: considerations on publicly funded ICT research and impact assessment"", , 2016.",https://doi.org/10.1145/2593690.2593696,1.0,Done already in 1.0
"V. Bauer, ""Analysing and supporting software reuse in practice"", , 2016.",https://doi.org/10.1109/EDUCON.2014.6826120,1.0,Extraction successful
"V. Bauer, ""Challenges of Structured Reuse Adoption - Lessons Learned"", PROFES, 2015.",https://doi.org/10.1007/978-3-319-11283-1_14,1.0,Abstract not found
"A. Sandberg, M. Staron, Vard Antinyan, ""Towards proactive management of technical debt by software metrics"", SPLST, 2015.",https://doi.org/10.14232/actacyb.21.3.2014.6,1.0,Extraction successful
"H. Brunelière, Jordi Cabot, ""On Developing Open Source MDE Tools: Our Eclipse Stories and Lessons Learned"", OSS4MDE@MoDELS, 2014.",https://doi.org/10.1109/SEAA.2013.61,1.0,Extraction successful
"P. Runeson, Sten Minör, Johan Svenér, ""Get the cogs in synch: time horizon aspects of industry--academia collaboration"", WISE@ASE, 2014.",https://doi.org/10.1109/MS.2013.94,1.0,Extraction successful
"P. Runeson, Sten Minör, ""The 4+1 view model of industry--academia collaboration"", WISE@ASE, 2014.",https://doi.org/10.1057/ejis.2012.35,1.0,Extraction successful
"H. H. Olsson, A. Sandberg, J. Bosch, Hiva Allahyari, ""Scale and Responsiveness in Large-Scale Software Development"", IEEE Software, 2014.",https://doi.org/10.11606/T.45.2013.TDE-25052015-120242,1.0,Abstract not found
"Silverio Martínez-Fernández, Helena Martins Marques, ""Practical experiences in designing and conducting empirical studies in industry-academia collaboration"", CESI 2014, 2014.",https://doi.org/10.1145/2460999.2461020,1.0,Abstract not found
"P. Sanchis, D. Astrain, A. Lopez-Martin, G. Perez-Artieda, E. Gubía, A. Ursúa, E. Tartas, Ignacio R. Matías, ""University-industry collaboration chairs: Initiatives at the Public University of Navarre"", 2014 IEEE Global Engineering Education Conference (EDUCON), 2014.",https://doi.org/10.1109/ICOS.2012.6417649,1.0,Extraction successful
"B. Andrés, R. Poler, ""INTERDISCIPLINARY EDUCATION AGENDA PROJECT: IMPROVING INNOVATION THROUGH ACADEMY‑INDUSTRY COLLABORATION"", , 2014.",https://doi.org/10.1016/j.jss.2012.04.054,1.0,Extraction successful
"DevelopmentHolmström Olsson, E. Ab, J. Bosch, H. Alahyari, ""Scale and Responsiveness in Large-Scale Software"", , 2014.",https://doi.org/10.1109/ICST.2012.190,1.0,Extraction successful
"P. Runeson, ""Problem formulation Problem / issue Industry Academia Study state of the art Candidate solution Static validation Validation in academia Dynamic validation Release solution"", , 2014.",No doi,1.0,DOI not found
"Vard Antinyan, M. Staron, Wilhelm Meding, ""Profiling Prerelease Software Product and Organizational Performance"", Continuous Software Engineering, 2014.",No doi,1.0,DOI not found
"Vard Antinyan, ""Empowering Technical Risk Assessment in Software Development"", , 2014.",No doi,1.0,DOI not found
"Vard Antinyan, M. Staron, J. Hansson, Wilhelm Meding, Per Österström, Anders Henriksson, ""Monitoring Evolution of Code Complexity and Magnitude of Changes"", Acta Cybern., 2014.",No doi,1.0,DOI not found
"R. Feldt, M. Staron, Erika Hult, Thomas Liljegren, ""Supporting Software Decision Meetings: Heatmaps for Visualising Test and Code Measurements"", 2013 39th Euromicro Conference on Software Engineering and Advanced Applications, 2013.",No doi,1.0,DOI not found
"D. Zhang, Shi Han, Yingnong Dang, Jian-Guang Lou, Haidong Zhang, Tao Xie, ""Software Analytics in Practice"", IEEE Software, 2013.",No doi,1.0,DOI not found
"L. Mathiassen, A. Sandberg, ""How a professionally qualified doctoral student bridged the practice-research gap: a confessional account of Collaborative Practice Research"", Eur. J. Inf. Syst., 2013.",No doi,1.0,DOI not found
"C. Melo, ""Productivity of agile teams: an empirical evaluation of factors and monitoring processes"", , 2013.",No doi,1.0,DOI not found
"M. T. Baldassarre, D. Caivano, G. Visaggio, ""Empirical studies for innovation dissemination: ten years of experience"", EASE '13, 2013.",No doi,1.0,DOI not found
"Vard Antinyan, M. Staron, Wilhelm Meding, Per Österströ, Henric Bergenwall, Johan Wranker, J. Hansson, Anders Henriksson, ""Monitoring Evolution of Code Complexity in Agile/Lean Software Development - A Case Study at Two Companies"", , 2013.",No doi,1.0,DOI not found
"N. A. Bakar, A. Selamat, ""Agent-based model checking verification framework"", 2012 IEEE Conference on Open Systems, 2012.",No doi,1.0,DOI not found
"L. Pareto, A. Sandberg, Peter S. Eriksson, Staffan Ehnebom, ""Collaborative prioritization of architectural concerns"", J. Syst. Softw., 2012.",No doi,1.0,DOI not found
"Ilya Belianka, A. Belyakov, ""Visualization of Log Files of Embedded Broadband Modules"", , 2012.",https://doi.org/10.1109/csmr-wcre.2014.6747165,1.0,Extraction successful
"P. Runeson, ""It Takes Two to Tango -- An Experience Report on Industry -- Academia Collaboration"", 2012 IEEE Fifth International Conference on Software Testing, Verification and Validation, 2012.",No doi,1.0,DOI not found
